13:03:51.262717 IP pfSense.localdomain.ssh > 192.168.56.1.49477: Flags [P.], ack 3879714205, win 520, options [nop,nop,TS val 2533035206 ecr 754962574], length 192
13:03:51.265263 IP 192.168.56.1.49477 > pfSense.localdomain.ssh: Flags [.], ack 192, win 8346, options [nop,nop,TS val 754962613 ecr 2533035206], length 0
13:03:54.699800 IP pfSense.localdomain.ssh > 192.168.56.1.49996: Flags [P.], ack 4006244417, win 520, options [nop,nop,TS val 706142913 ecr 754936173], length 68
13:03:54.701010 IP 192.168.56.1.49996 > pfSense.localdomain.ssh: Flags [.], ack 68, win 8187, options [nop,nop,TS val 754966027 ecr 706142913], length 0
13:03:54.701202 IP 192.168.56.1.49996 > pfSense.localdomain.ssh: Flags [P.], ack 68, win 8192, options [nop,nop,TS val 754966027 ecr 706142913], length 36
13:03:54.701328 IP pfSense.localdomain.ssh > 192.168.56.1.49996: Flags [.], ack 37, win 520, options [nop,nop,TS val 706142913 ecr 754966027], length 0
13:04:21.360257 IP pfSense.localdomain.ssh > 192.168.56.1.49477: Flags [P.], ack 1, win 520, options [nop,nop,TS val 2533038208 ecr 754962613], length 64
13:04:21.360929 IP 192.168.56.1.49477 > pfSense.localdomain.ssh: Flags [.], ack 256, win 8354, options [nop,nop,TS val 754992649 ecr 2533038208], length 0
13:04:21.361118 IP 192.168.56.1.49477 > pfSense.localdomain.ssh: Flags [P.], ack 256, win 8358, options [nop,nop,TS val 754992649 ecr 2533038208], length 32
13:04:21.361237 IP pfSense.localdomain.ssh > 192.168.56.1.49477: Flags [.], ack 33, win 520, options [nop,nop,TS val 2533038208 ecr 754992649], length 0
13:04:24.794174 IP pfSense.localdomain.ssh > 192.168.56.1.49996: Flags [P.], ack 37, win 520, options [nop,nop,TS val 706145914 ecr 754966027], length 68
13:04:24.795343 IP 192.168.56.1.49996 > pfSense.localdomain.ssh: Flags [.], ack 136, win 8187, options [nop,nop,TS val 754996061 ecr 706145914], length 0
13:04:24.795654 IP 192.168.56.1.49996 > pfSense.localdomain.ssh: Flags [P.], ack 136, win 8192, options [nop,nop,TS val 754996061 ecr 706145914], length 36
13:04:24.795875 IP pfSense.localdomain.ssh > 192.168.56.1.49996: Flags [.], ack 73, win 520, options [nop,nop,TS val 706145914 ecr 754996061], length 0
13:04:36.011861 IP6 :: > ff02::16: HBH ICMP6, multicast listener report v2, 1 group record(s), length 28
13:04:36.387143 ARP, Request who-has pfSense.localdomain tell 192.168.56.9, length 46
13:04:36.387372 ARP, Reply pfSense.localdomain is-at 08:00:27:83:6d:03 (oui Unknown), length 28
13:04:36.387662 IP 192.168.56.9.46048 > vm0004.panoulu.local.domain: 21443+ SOA? local. (23)
13:04:36.451177 IP6 :: > ff02::1:ff4c:4ffd: ICMP6, neighbor solicitation, who has fe80::a00:27ff:fe4c:4ffd, length 24
13:04:36.522650 IP vm0004.panoulu.local.domain > 192.168.56.9.46048: 21443 NXDomain 0/1/0 (98)
13:04:36.525468 IP 192.168.56.9.38971 > vm0004.panoulu.local.domain: 34316+ SOA? local. (23)
13:04:36.530034 IP vm0004.panoulu.local.domain > 192.168.56.9.38971: 34316 NXDomain 0/1/0 (98)
13:04:36.558061 IP6 :: > ff02::16: HBH ICMP6, multicast listener report v2, 2 group record(s), length 48
13:04:37.451414 IP6 fe80::a00:27ff:fe4c:4ffd > ff02::2: ICMP6, router solicitation, length 16
13:04:41.458869 IP6 fe80::a00:27ff:fe4c:4ffd > ff02::2: ICMP6, router solicitation, length 16
13:04:41.550422 IP6 fe80::a00:27ff:fe4c:4ffd > ff02::16: HBH ICMP6, multicast listener report v2, 2 group record(s), length 48
13:04:41.550925 IP 192.168.56.9 > igmp.mcast.net: igmp v3 report, 1 group record(s)
13:04:41.695617 IP6 fe80::a00:27ff:fe4c:4ffd > ff02::16: HBH ICMP6, multicast listener report v2, 1 group record(s), length 28
13:04:41.717492 IP6 fe80::a00:27ff:fe4c:4ffd.5353 > ff02::fb.5353: 0 [2q] [3n][|domain]
13:04:41.717749 IP 192.168.56.9.5353 > 224.0.0.251.5353: 0 [3q] [5n][|domain]
13:04:41.968200 IP6 fe80::a00:27ff:fe4c:4ffd.5353 > ff02::fb.5353: 0 [2q] [3n][|domain]
13:04:41.969662 IP 192.168.56.9.5353 > 224.0.0.251.5353: 0 [3q] [5n][|domain]
13:04:42.219319 IP6 fe80::a00:27ff:fe4c:4ffd.5353 > ff02::fb.5353: 0 [2q] [3n][|domain]
13:04:42.220250 IP 192.168.56.9.5353 > 224.0.0.251.5353: 0 [3q] [5n][|domain]
13:04:42.420081 IP 192.168.56.9.5353 > 224.0.0.251.5353: 0*- [0q] 5/0/0[|domain]
13:04:42.420481 IP6 fe80::a00:27ff:fe4c:4ffd.5353 > ff02::fb.5353: 0*- [0q] 3/0/0[|domain]
13:04:42.589684 IP6 fe80::a00:27ff:fe4c:4ffd.5353 > ff02::fb.5353: 0 [2n][|domain]
13:04:42.591150 IP 192.168.56.9.5353 > 224.0.0.251.5353: 0 [2n][|domain]
13:04:42.840014 IP6 fe80::a00:27ff:fe4c:4ffd.5353 > ff02::fb.5353: 0 [2n][|domain]
13:04:42.840499 IP 192.168.56.9.5353 > 224.0.0.251.5353: 0 [2n][|domain]
13:04:43.090766 IP6 fe80::a00:27ff:fe4c:4ffd.5353 > ff02::fb.5353: 0 [2n][|domain]
13:04:43.091157 IP 192.168.56.9.5353 > 224.0.0.251.5353: 0 [2n][|domain]
13:04:43.159257 IP 192.168.56.9.43148 > vm0004.panoulu.local.domain: 9446+ AAAA? debian-virtual-2.panoulu.local. (48)
13:04:43.161826 IP vm0004.panoulu.local.domain > 192.168.56.9.43148: 9446 NXDomain* 0/1/0 (103)
13:04:43.162171 IP 192.168.56.9.54227 > vm0004.panoulu.local.domain: 778+ AAAA? debian-virtual-2. (34)
13:04:43.164792 IP vm0004.panoulu.local.domain > 192.168.56.9.54227: 778 NXDomain 0/1/0 (109)
13:04:43.221501 IP 192.168.56.9.58629 > vm0004.panoulu.local.domain: 50435+ AAAA? debian-virtual-2.panoulu.local. (48)
13:04:43.224162 IP vm0004.panoulu.local.domain > 192.168.56.9.58629: 50435 NXDomain* 0/1/0 (103)
13:04:43.224638 IP 192.168.56.9.45261 > vm0004.panoulu.local.domain: 52287+ AAAA? debian-virtual-2. (34)
13:04:43.226333 IP vm0004.panoulu.local.domain > 192.168.56.9.45261: 52287 NXDomain 0/1/0 (109)
13:04:43.265035 IP 192.168.56.9.56060 > vm0004.panoulu.local.domain: 50739+ AAAA? debian-virtual-2.panoulu.local. (48)
13:04:43.267027 IP vm0004.panoulu.local.domain > 192.168.56.9.56060: 50739 NXDomain* 0/1/0 (103)
13:04:43.267430 IP 192.168.56.9.45227 > vm0004.panoulu.local.domain: 31876+ AAAA? debian-virtual-2. (34)
13:04:43.268851 IP vm0004.panoulu.local.domain > 192.168.56.9.45227: 31876 NXDomain 0/1/0 (109)
13:04:43.290497 IP 192.168.56.9.5353 > 224.0.0.251.5353: 0*- [0q] 6/0/0[|domain]
13:04:43.291164 IP6 fe80::a00:27ff:fe4c:4ffd.5353 > ff02::fb.5353: 0*- [0q] 5/0/0[|domain]
13:04:43.314577 IP 192.168.56.9.42501 > vm0004.panoulu.local.domain: 55347+ AAAA? debian-virtual-2.panoulu.local. (48)
13:04:43.318878 IP vm0004.panoulu.local.domain > 192.168.56.9.42501: 55347 NXDomain* 0/1/0 (103)
13:04:43.320347 IP 192.168.56.9.45197 > vm0004.panoulu.local.domain: 35882+ AAAA? debian-virtual-2. (34)
13:04:43.323483 IP vm0004.panoulu.local.domain > 192.168.56.9.45197: 35882 NXDomain 0/1/0 (109)
13:04:43.541799 IP 192.168.56.9.5353 > 224.0.0.251.5353: 0*- [0q] 3/0/0[|domain]
13:04:43.542159 IP6 fe80::a00:27ff:fe4c:4ffd.5353 > ff02::fb.5353: 0*- [0q] 2/0/0[|domain]
13:04:43.544093 IP 192.168.56.9.53333 > vm0004.panoulu.local.domain: 21344+ A? 0.debian.pool.ntp.org. (39)
13:04:43.544729 IP 192.168.56.9.53333 > vm0004.panoulu.local.domain: 41205+ AAAA? 0.debian.pool.ntp.org. (39)
13:04:43.628782 IP vm0004.panoulu.local.domain > 192.168.56.9.53333: 21344 4/9/15 A[|domain]
13:04:43.629207 IP vm0004.panoulu.local.domain > 192.168.56.9.53333: 41205 0/1/0 (103)
13:04:43.631611 IP 192.168.56.9.46931 > vm0004.panoulu.local.domain: 65388+ A? 1.debian.pool.ntp.org. (39)
13:04:43.632169 IP 192.168.56.9.46931 > vm0004.panoulu.local.domain: 39415+ AAAA? 1.debian.pool.ntp.org. (39)
13:04:43.658836 IP 192.168.56.9 > igmp.mcast.net: igmp v3 report, 1 group record(s)
13:04:43.711053 IP vm0004.panoulu.local.domain > 192.168.56.9.46931: 65388 4/9/15 A[|domain]
13:04:43.715788 IP vm0004.panoulu.local.domain > 192.168.56.9.46931: 39415 0/1/0 (103)
13:04:43.716592 IP 192.168.56.9.52995 > vm0004.panoulu.local.domain: 27018+ A? 2.debian.pool.ntp.org. (39)
13:04:43.717067 IP 192.168.56.9.52995 > vm0004.panoulu.local.domain: 15404+ AAAA? 2.debian.pool.ntp.org. (39)
13:04:43.790462 IP vm0004.panoulu.local.domain > 192.168.56.9.52995: 27018 4/9/15 A[|domain]
13:04:43.790621 IP vm0004.panoulu.local.domain > 192.168.56.9.52995: 15404 4/9/12 AAAA[|domain]
13:04:43.791248 IP 192.168.56.9.38333 > vm0004.panoulu.local.domain: 1496+ A? 3.debian.pool.ntp.org. (39)
13:04:43.791730 IP 192.168.56.9.38333 > vm0004.panoulu.local.domain: 7570+ AAAA? 3.debian.pool.ntp.org. (39)
13:04:43.839173 IP vm0004.panoulu.local.domain > 192.168.56.9.38333: 1496 4/9/15 A[|domain]
13:04:43.842617 IP vm0004.panoulu.local.domain > 192.168.56.9.38333: 7570 0/1/0 (103)
13:04:44.410851 IP 192.168.56.9.5353 > 224.0.0.251.5353: 0*- [0q] 6/0/0[|domain]
13:04:44.412122 IP6 fe80::a00:27ff:fe4c:4ffd.5353 > ff02::fb.5353: 0*- [0q] 5/0/0[|domain]
13:04:44.514397 IP 192.168.56.9.ntp > maukkaat.tontut.fi.ntp: NTPv4, Client, length 48
13:04:44.532321 IP maukkaat.tontut.fi.ntp > 192.168.56.9.ntp: NTPv4, Server, length 48
13:04:45.464933 IP6 fe80::a00:27ff:fe4c:4ffd > ff02::2: ICMP6, router solicitation, length 16
13:04:45.514494 IP 192.168.56.9.ntp > sigma.baytems.com.ntp: NTPv4, Client, length 48
13:04:45.532560 IP sigma.baytems.com.ntp > 192.168.56.9.ntp: NTPv4, Server, length 48
13:04:45.662645 IP 192.168.56.9.5353 > 224.0.0.251.5353: 0*- [0q] 5/0/0[|domain]
13:04:45.663709 IP6 fe80::a00:27ff:fe4c:4ffd.5353 > ff02::fb.5353: 0*- [0q] 3/0/0[|domain]
13:04:46.514620 IP 192.168.56.9.ntp > maukkaat.tontut.fi.ntp: NTPv4, Client, length 48
13:04:46.516118 IP 192.168.56.9.ntp > ntp.maimed.org.ntp: NTPv4, Client, length 48
13:04:46.530331 IP maukkaat.tontut.fi.ntp > 192.168.56.9.ntp: NTPv4, Server, length 48
13:04:46.532029 IP 192.168.56.9.5353 > 224.0.0.251.5353: 0*- [0q] 6/0/0[|domain]
13:04:46.532773 IP6 fe80::a00:27ff:fe4c:4ffd.5353 > ff02::fb.5353: 0*- [0q] 5/0/0[|domain]
13:04:46.691466 IP ntp.maimed.org.ntp > 192.168.56.9.ntp: NTPv4, Server, length 48
13:04:47.514092 IP 192.168.56.9.ntp > sigma.baytems.com.ntp: NTPv4, Client, length 48
13:04:47.514854 IP 192.168.56.9.ntp > ntp1.tdc.fi.ntp: NTPv4, Client, length 48
13:04:47.527224 IP ntp1.tdc.fi.ntp > 192.168.56.9.ntp: NTPv4, Server, length 48
13:04:47.532034 IP sigma.baytems.com.ntp > 192.168.56.9.ntp: NTPv4, Server, length 48
13:04:48.516774 IP 192.168.56.9.ntp > maukkaat.tontut.fi.ntp: NTPv4, Client, length 48
13:04:48.517862 IP 192.168.56.9.ntp > ntp.maimed.org.ntp: NTPv4, Client, length 48
13:04:48.532212 IP maukkaat.tontut.fi.ntp > 192.168.56.9.ntp: NTPv4, Server, length 48
13:04:48.736711 IP ntp.maimed.org.ntp > 192.168.56.9.ntp: NTPv4, Server, length 48
13:04:49.514262 IP 192.168.56.9.ntp > sigma.baytems.com.ntp: NTPv4, Client, length 48
13:04:49.517288 IP 192.168.56.9.ntp > ntp1.tdc.fi.ntp: NTPv4, Client, length 48
13:04:49.528167 IP ntp1.tdc.fi.ntp > 192.168.56.9.ntp: NTPv4, Server, length 48
13:04:49.533275 IP sigma.baytems.com.ntp > 192.168.56.9.ntp: NTPv4, Server, length 48
13:04:50.513724 IP 192.168.56.9.ntp > maukkaat.tontut.fi.ntp: NTPv4, Client, length 48
13:04:50.516331 IP 192.168.56.9.ntp > ntp.maimed.org.ntp: NTPv4, Client, length 48
13:04:50.529894 IP maukkaat.tontut.fi.ntp > 192.168.56.9.ntp: NTPv4, Server, length 48
13:04:50.665089 IP ntp.maimed.org.ntp > 192.168.56.9.ntp: NTPv4, Server, length 48
13:04:51.400382 IP pfSense.localdomain.ssh > 192.168.56.1.49477: Flags [P.], ack 33, win 520, options [nop,nop,TS val 2533041209 ecr 754992649], length 64
13:04:51.401958 IP 192.168.56.1.49477 > pfSense.localdomain.ssh: Flags [.], ack 320, win 8354, options [nop,nop,TS val 755022623 ecr 2533041209], length 0
13:04:51.403065 IP 192.168.56.1.49477 > pfSense.localdomain.ssh: Flags [P.], ack 320, win 8358, options [nop,nop,TS val 755022623 ecr 2533041209], length 32
13:04:51.403575 IP pfSense.localdomain.ssh > 192.168.56.1.49477: Flags [.], ack 65, win 520, options [nop,nop,TS val 2533041209 ecr 755022623], length 0
13:04:51.512160 IP 192.168.56.9.ntp > sigma.baytems.com.ntp: NTPv4, Client, length 48
13:04:51.512900 IP 192.168.56.9.ntp > ntp1.tdc.fi.ntp: NTPv4, Client, length 48
13:04:51.522290 IP ntp1.tdc.fi.ntp > 192.168.56.9.ntp: NTPv4, Server, length 48
13:04:51.530374 IP sigma.baytems.com.ntp > 192.168.56.9.ntp: NTPv4, Server, length 48
13:04:52.515543 IP 192.168.56.9.ntp > maukkaat.tontut.fi.ntp: NTPv4, Client, length 48
13:04:52.527170 IP maukkaat.tontut.fi.ntp > 192.168.56.9.ntp: NTPv4, Server, length 48
13:04:53.513451 IP 192.168.56.9.ntp > sigma.baytems.com.ntp: NTPv4, Client, length 48
13:04:53.515390 IP 192.168.56.9.ntp > ntp1.tdc.fi.ntp: NTPv4, Client, length 48
13:04:53.525345 IP ntp1.tdc.fi.ntp > 192.168.56.9.ntp: NTPv4, Server, length 48
13:04:53.531058 IP sigma.baytems.com.ntp > 192.168.56.9.ntp: NTPv4, Server, length 48
13:04:54.514506 IP 192.168.56.9.ntp > maukkaat.tontut.fi.ntp: NTPv4, Client, length 48
13:04:54.532425 IP maukkaat.tontut.fi.ntp > 192.168.56.9.ntp: NTPv4, Server, length 48
13:04:54.828871 IP 192.168.56.1.49996 > pfSense.localdomain.ssh: Flags [.], ack 204, win 8187, options [nop,nop,TS val 755026038 ecr 706148915], length 0
13:04:54.830488 IP pfSense.localdomain.ssh > 192.168.56.1.49996: Flags [P.], ack 73, win 520, options [nop,nop,TS val 706148915 ecr 754996061], length 68
13:04:54.831020 IP 192.168.56.1.49996 > pfSense.localdomain.ssh: Flags [P.], ack 204, win 8192, options [nop,nop,TS val 755026038 ecr 706148915], length 36
13:04:54.831374 IP pfSense.localdomain.ssh > 192.168.56.1.49996: Flags [.], ack 109, win 520, options [nop,nop,TS val 706148915 ecr 755026038], length 0
13:04:55.515406 IP 192.168.56.9.ntp > sigma.baytems.com.ntp: NTPv4, Client, length 48
13:04:55.517572 IP 192.168.56.9.ntp > ntp1.tdc.fi.ntp: NTPv4, Client, length 48
13:04:55.528452 IP ntp1.tdc.fi.ntp > 192.168.56.9.ntp: NTPv4, Server, length 48
13:04:55.533548 IP sigma.baytems.com.ntp > 192.168.56.9.ntp: NTPv4, Server, length 48
13:04:56.516722 IP 192.168.56.9.ntp > maukkaat.tontut.fi.ntp: NTPv4, Client, length 48
13:04:56.542681 IP maukkaat.tontut.fi.ntp > 192.168.56.9.ntp: NTPv4, Server, length 48
13:04:57.515646 IP 192.168.56.9.ntp > sigma.baytems.com.ntp: NTPv4, Client, length 48
13:04:57.518015 IP 192.168.56.9.ntp > ntp1.tdc.fi.ntp: NTPv4, Client, length 48
13:04:57.527169 ARP, Request who-has pfSense.localdomain tell 192.168.56.9, length 46
13:04:57.527265 ARP, Reply pfSense.localdomain is-at 08:00:27:83:6d:03 (oui Unknown), length 28
13:04:57.529726 IP ntp1.tdc.fi.ntp > 192.168.56.9.ntp: NTPv4, Server, length 48
13:04:57.533795 IP sigma.baytems.com.ntp > 192.168.56.9.ntp: NTPv4, Server, length 48
13:04:58.514974 IP 192.168.56.9.ntp > maukkaat.tontut.fi.ntp: NTPv4, Client, length 48
13:04:58.534062 IP maukkaat.tontut.fi.ntp > 192.168.56.9.ntp: NTPv4, Server, length 48
13:04:58.614133 IP 192.168.56.9 > pfSense.localdomain: ICMP echo request, id 2929, seq 1, length 64
13:04:58.614968 IP pfSense.localdomain > 192.168.56.9: ICMP echo reply, id 2929, seq 1, length 64
13:04:59.518196 IP 192.168.56.9.ntp > sigma.baytems.com.ntp: NTPv4, Client, length 48
13:04:59.519158 IP 192.168.56.9.ntp > ntp1.tdc.fi.ntp: NTPv4, Client, length 48
13:04:59.531706 IP ntp1.tdc.fi.ntp > 192.168.56.9.ntp: NTPv4, Server, length 48
13:04:59.536279 IP sigma.baytems.com.ntp > 192.168.56.9.ntp: NTPv4, Server, length 48
13:04:59.618914 IP 192.168.56.9 > pfSense.localdomain: ICMP echo request, id 2929, seq 2, length 64
13:04:59.619369 IP pfSense.localdomain > 192.168.56.9: ICMP echo reply, id 2929, seq 2, length 64
13:05:00.622824 IP 192.168.56.9 > pfSense.localdomain: ICMP echo request, id 2929, seq 3, length 64
13:05:00.623072 IP pfSense.localdomain > 192.168.56.9: ICMP echo reply, id 2929, seq 3, length 64
13:05:01.519447 IP 192.168.56.9.ntp > ntp1.tdc.fi.ntp: NTPv4, Client, length 48
13:05:01.533286 IP ntp1.tdc.fi.ntp > 192.168.56.9.ntp: NTPv4, Server, length 48
13:05:01.626357 IP 192.168.56.9 > pfSense.localdomain: ICMP echo request, id 2929, seq 4, length 64
13:05:01.626481 IP pfSense.localdomain > 192.168.56.9: ICMP echo reply, id 2929, seq 4, length 64
13:05:02.629683 IP 192.168.56.9 > pfSense.localdomain: ICMP echo request, id 2929, seq 5, length 64
13:05:02.630695 IP pfSense.localdomain > 192.168.56.9: ICMP echo reply, id 2929, seq 5, length 64
13:05:03.634392 IP 192.168.56.9 > pfSense.localdomain: ICMP echo request, id 2929, seq 6, length 64
13:05:03.635164 IP pfSense.localdomain > 192.168.56.9: ICMP echo reply, id 2929, seq 6, length 64
13:05:04.636710 IP 192.168.56.9 > pfSense.localdomain: ICMP echo request, id 2929, seq 7, length 64
13:05:04.637430 IP pfSense.localdomain > 192.168.56.9: ICMP echo reply, id 2929, seq 7, length 64
13:05:05.641172 IP 192.168.56.9 > pfSense.localdomain: ICMP echo request, id 2929, seq 8, length 64
13:05:05.642038 IP pfSense.localdomain > 192.168.56.9: ICMP echo reply, id 2929, seq 8, length 64
13:05:06.644719 IP 192.168.56.9 > pfSense.localdomain: ICMP echo request, id 2929, seq 9, length 64
13:05:06.644903 IP pfSense.localdomain > 192.168.56.9: ICMP echo reply, id 2929, seq 9, length 64
13:05:07.646113 IP 192.168.56.9 > pfSense.localdomain: ICMP echo request, id 2929, seq 10, length 64
13:05:07.647428 IP pfSense.localdomain > 192.168.56.9: ICMP echo reply, id 2929, seq 10, length 64
13:05:14.101447 IP 192.168.56.9.40409 > vm0004.panoulu.local.domain: 45101+ A? security.debian.org. (37)
13:05:14.102088 IP 192.168.56.9.40409 > vm0004.panoulu.local.domain: 25828+ AAAA? security.debian.org. (37)
13:05:14.105166 IP 192.168.56.9.52378 > vm0004.panoulu.local.domain: 7065+ A? ftp.fi.debian.org. (35)
13:05:14.105398 IP 192.168.56.9.52378 > vm0004.panoulu.local.domain: 14415+ AAAA? ftp.fi.debian.org. (35)
13:05:14.107192 IP vm0004.panoulu.local.domain > 192.168.56.9.52378: 7065 1/4/2 A 130.230.54.99 (177)
13:05:14.107233 IP vm0004.panoulu.local.domain > 192.168.56.9.52378: 14415 1/4/2 AAAA[|domain]
13:05:14.108235 IP 192.168.56.9.48644 > ftp.fi.debian.org.http: Flags [S], seq 3740899694, win 14600, options [mss 1460,sackOK,TS val 4294904722 ecr 0,nop,wscale 3], length 0
13:05:14.121731 IP ftp.fi.debian.org.http > 192.168.56.9.48644: Flags [S.], seq 49472001, ack 3740899695, win 65535, options [mss 1460], length 0
13:05:14.123547 IP 192.168.56.9.48644 > ftp.fi.debian.org.http: Flags [.], ack 1, win 14600, length 0
13:05:14.127073 IP 192.168.56.9.48644 > ftp.fi.debian.org.http: Flags [P.], ack 1, win 14600, length 217
13:05:14.128154 IP ftp.fi.debian.org.http > 192.168.56.9.48644: Flags [.], ack 218, win 65535, length 0
13:05:14.140189 IP ftp.fi.debian.org.http > 192.168.56.9.48644: Flags [P.], ack 218, win 65535, length 136
13:05:14.140468 IP ftp.fi.debian.org.http > 192.168.56.9.48644: Flags [F.], seq 137, ack 218, win 65535, length 0
13:05:14.140955 IP 192.168.56.9.48644 > ftp.fi.debian.org.http: Flags [.], ack 137, win 15544, length 0
13:05:14.141483 IP 192.168.56.9.48644 > ftp.fi.debian.org.http: Flags [F.], seq 218, ack 138, win 15544, length 0
13:05:14.141983 IP ftp.fi.debian.org.http > 192.168.56.9.48644: Flags [.], ack 219, win 65535, length 0
13:05:14.144573 IP 192.168.56.9.48645 > ftp.fi.debian.org.http: Flags [S], seq 2602996629, win 14600, options [mss 1460,sackOK,TS val 4294904731 ecr 0,nop,wscale 3], length 0
13:05:14.146691 IP vm0004.panoulu.local.domain > 192.168.56.9.40409: 25828 3/3/0 AAAA[|domain]
13:05:14.147128 IP vm0004.panoulu.local.domain > 192.168.56.9.40409: 45101 3/3/0 A 212.211.132.250,[|domain]
13:05:14.147992 IP 192.168.56.9.39941 > lobos.debian.org.http: Flags [S], seq 1484028402, win 14600, options [mss 1460,sackOK,TS val 4294904732 ecr 0,nop,wscale 3], length 0
13:05:14.157779 IP ftp.fi.debian.org.http > 192.168.56.9.48645: Flags [S.], seq 49536001, ack 2602996630, win 65535, options [mss 1460], length 0
13:05:14.158599 IP 192.168.56.9.48645 > ftp.fi.debian.org.http: Flags [.], ack 1, win 14600, length 0
13:05:14.159557 IP 192.168.56.9.48645 > ftp.fi.debian.org.http: Flags [P.], ack 1, win 14600, length 225
13:05:14.160270 IP ftp.fi.debian.org.http > 192.168.56.9.48645: Flags [.], ack 226, win 65535, length 0
13:05:14.175227 IP ftp.fi.debian.org.http > 192.168.56.9.48645: Flags [.], ack 226, win 65535, length 1420
13:05:14.175364 IP ftp.fi.debian.org.http > 192.168.56.9.48645: Flags [P.], ack 226, win 65535, length 408
13:05:14.175479 IP ftp.fi.debian.org.http > 192.168.56.9.48645: Flags [F.], seq 1829, ack 226, win 65535, length 0
13:05:14.175875 IP 192.168.56.9.48645 > ftp.fi.debian.org.http: Flags [.], ack 1421, win 17040, length 0
13:05:14.176025 IP 192.168.56.9.48645 > ftp.fi.debian.org.http: Flags [.], ack 1829, win 19880, length 0
13:05:14.176555 IP 192.168.56.9.48645 > ftp.fi.debian.org.http: Flags [F.], seq 226, ack 1830, win 19880, length 0
13:05:14.176937 IP ftp.fi.debian.org.http > 192.168.56.9.48645: Flags [.], ack 227, win 65535, length 0
13:05:14.180939 IP 192.168.56.9.48647 > ftp.fi.debian.org.http: Flags [S], seq 2767337161, win 14600, options [mss 1460,sackOK,TS val 4294904740 ecr 0,nop,wscale 3], length 0
13:05:14.193194 IP lobos.debian.org.http > 192.168.56.9.39941: Flags [S.], seq 49600001, ack 1484028403, win 65535, options [mss 1460], length 0
13:05:14.194158 IP 192.168.56.9.39941 > lobos.debian.org.http: Flags [.], ack 1, win 14600, length 0
13:05:14.194915 IP 192.168.56.9.39941 > lobos.debian.org.http: Flags [P.], ack 1, win 14600, length 220
13:05:14.195569 IP ftp.fi.debian.org.http > 192.168.56.9.48647: Flags [S.], seq 49664001, ack 2767337162, win 65535, options [mss 1460], length 0
13:05:14.195649 IP lobos.debian.org.http > 192.168.56.9.39941: Flags [.], ack 221, win 65535, length 0
13:05:14.196003 IP 192.168.56.9.48647 > ftp.fi.debian.org.http: Flags [.], ack 1, win 14600, length 0
13:05:14.196359 IP 192.168.56.9.48647 > ftp.fi.debian.org.http: Flags [P.], ack 1, win 14600, length 229
13:05:14.197199 IP ftp.fi.debian.org.http > 192.168.56.9.48647: Flags [.], ack 230, win 65535, length 0
13:05:14.208739 IP ftp.fi.debian.org.http > 192.168.56.9.48647: Flags [P.], ack 230, win 65535, length 138
13:05:14.209511 IP ftp.fi.debian.org.http > 192.168.56.9.48647: Flags [F.], seq 139, ack 230, win 65535, length 0
13:05:14.212509 IP 192.168.56.9.48647 > ftp.fi.debian.org.http: Flags [.], ack 139, win 15544, length 0
13:05:14.213185 IP 192.168.56.9.48647 > ftp.fi.debian.org.http: Flags [F.], seq 230, ack 140, win 15544, length 0
13:05:14.215033 IP ftp.fi.debian.org.http > 192.168.56.9.48647: Flags [.], ack 231, win 65535, length 0
13:05:14.239437 IP lobos.debian.org.http > 192.168.56.9.39941: Flags [P.], ack 221, win 65535, length 1107
13:05:14.240383 IP 192.168.56.9.39941 > lobos.debian.org.http: Flags [.], ack 1108, win 16605, length 0
13:05:14.247490 IP 192.168.56.9.48648 > ftp.fi.debian.org.http: Flags [S], seq 4238514491, win 14600, options [mss 1460,sackOK,TS val 4294904757 ecr 0,nop,wscale 3], length 0
13:05:14.250751 IP 192.168.56.9.39941 > lobos.debian.org.http: Flags [P.], ack 1108, win 16605, length 232
13:05:14.251527 IP lobos.debian.org.http > 192.168.56.9.39941: Flags [.], ack 453, win 65535, length 0
13:05:14.263397 IP ftp.fi.debian.org.http > 192.168.56.9.48648: Flags [S.], seq 49728001, ack 4238514492, win 65535, options [mss 1460], length 0
13:05:14.264145 IP 192.168.56.9.48648 > ftp.fi.debian.org.http: Flags [.], ack 1, win 14600, length 0
13:05:14.264529 IP 192.168.56.9.48648 > ftp.fi.debian.org.http: Flags [P.], ack 1, win 14600, length 237
13:05:14.264837 IP ftp.fi.debian.org.http > 192.168.56.9.48648: Flags [.], ack 238, win 65535, length 0
13:05:14.279518 IP ftp.fi.debian.org.http > 192.168.56.9.48648: Flags [.], ack 238, win 65535, length 1420
13:05:14.279889 IP ftp.fi.debian.org.http > 192.168.56.9.48648: Flags [P.], ack 238, win 65535, length 28
13:05:14.280119 IP ftp.fi.debian.org.http > 192.168.56.9.48648: Flags [.], ack 238, win 65535, length 1420
13:05:14.280521 IP 192.168.56.9.48648 > ftp.fi.debian.org.http: Flags [.], ack 1421, win 17040, length 0
13:05:14.280849 IP ftp.fi.debian.org.http > 192.168.56.9.48648: Flags [.], ack 238, win 65535, length 1420
13:05:14.280919 IP ftp.fi.debian.org.http > 192.168.56.9.48648: Flags [.], ack 238, win 65535, length 1420
13:05:14.281214 IP 192.168.56.9.48648 > ftp.fi.debian.org.http: Flags [.], ack 1449, win 17040, length 0
13:05:14.281274 IP 192.168.56.9.48648 > ftp.fi.debian.org.http: Flags [.], ack 2869, win 19880, length 0
13:05:14.281348 IP 192.168.56.9.48648 > ftp.fi.debian.org.http: Flags [.], ack 4289, win 22720, length 0
13:05:14.281431 IP 192.168.56.9.48648 > ftp.fi.debian.org.http: Flags [.], ack 5709, win 25560, length 0
13:05:14.281662 IP ftp.fi.debian.org.http > 192.168.56.9.48648: Flags [.], ack 238, win 65535, length 1420
13:05:14.281725 IP ftp.fi.debian.org.http > 192.168.56.9.48648: Flags [.], ack 238, win 65535, length 1420
13:05:14.281819 IP ftp.fi.debian.org.http > 192.168.56.9.48648: Flags [.], ack 238, win 65535, length 1420
13:05:14.281882 IP ftp.fi.debian.org.http > 192.168.56.9.48648: Flags [.], ack 238, win 65535, length 1420
13:05:14.281945 IP ftp.fi.debian.org.http > 192.168.56.9.48648: Flags [.], ack 238, win 65535, length 1420
13:05:14.282022 IP ftp.fi.debian.org.http > 192.168.56.9.48648: Flags [.], ack 238, win 65535, length 1420
13:05:14.282095 IP ftp.fi.debian.org.http > 192.168.56.9.48648: Flags [P.], ack 238, win 65535, length 252
13:05:14.282142 IP 192.168.56.9.48648 > ftp.fi.debian.org.http: Flags [.], ack 7129, win 28400, length 0
13:05:14.282246 IP 192.168.56.9.48648 > ftp.fi.debian.org.http: Flags [.], ack 8549, win 31240, length 0
13:05:14.282617 IP 192.168.56.9.48648 > ftp.fi.debian.org.http: Flags [.], ack 9969, win 34080, length 0
13:05:14.282671 IP 192.168.56.9.48648 > ftp.fi.debian.org.http: Flags [.], ack 11389, win 36920, length 0
13:05:14.282718 IP 192.168.56.9.48648 > ftp.fi.debian.org.http: Flags [.], ack 12809, win 36920, length 0
13:05:14.282765 IP 192.168.56.9.48648 > ftp.fi.debian.org.http: Flags [.], ack 14229, win 36920, length 0
13:05:14.285906 IP 192.168.56.9.48648 > ftp.fi.debian.org.http: Flags [.], ack 14481, win 36668, length 0
13:05:14.294075 IP ftp.fi.debian.org.http > 192.168.56.9.48648: Flags [.], ack 238, win 65535, length 1420
13:05:14.295077 IP ftp.fi.debian.org.http > 192.168.56.9.48648: Flags [.], ack 238, win 65535, length 1420
13:05:14.295205 IP ftp.fi.debian.org.http > 192.168.56.9.48648: Flags [.], ack 238, win 65535, length 1420
13:05:14.295313 IP ftp.fi.debian.org.http > 192.168.56.9.48648: Flags [P.], ack 238, win 65535, length 84
13:05:14.295468 IP ftp.fi.debian.org.http > 192.168.56.9.48648: Flags [.], ack 238, win 65535, length 1420
13:05:14.295582 IP ftp.fi.debian.org.http > 192.168.56.9.48648: Flags [.], ack 238, win 65535, length 1420
13:05:14.295668 IP ftp.fi.debian.org.http > 192.168.56.9.48648: Flags [P.], ack 238, win 65535, length 56
13:05:14.295753 IP ftp.fi.debian.org.http > 192.168.56.9.48648: Flags [.], ack 238, win 65535, length 1420
13:05:14.295885 IP ftp.fi.debian.org.http > 192.168.56.9.48648: Flags [.], ack 238, win 65535, length 1420
13:05:14.295971 IP ftp.fi.debian.org.http > 192.168.56.9.48648: Flags [.], ack 238, win 65535, length 1420
13:05:14.296047 IP ftp.fi.debian.org.http > 192.168.56.9.48648: Flags [.], ack 238, win 65535, length 1420
13:05:14.296185 IP ftp.fi.debian.org.http > 192.168.56.9.48648: Flags [.], ack 238, win 65535, length 1420
13:05:14.296254 IP ftp.fi.debian.org.http > 192.168.56.9.48648: Flags [P.], ack 238, win 65535, length 140
13:05:14.296326 IP ftp.fi.debian.org.http > 192.168.56.9.48648: Flags [.], ack 238, win 65535, length 1420
13:05:14.296396 IP ftp.fi.debian.org.http > 192.168.56.9.48648: Flags [.], ack 238, win 65535, length 1420
13:05:14.296459 IP ftp.fi.debian.org.http > 192.168.56.9.48648: Flags [P.], ack 238, win 65535, length 56
13:05:14.296514 IP 192.168.56.9.48648 > ftp.fi.debian.org.http: Flags [.], ack 15901, win 41180, length 0
13:05:14.299502 IP 192.168.56.9.48648 > ftp.fi.debian.org.http: Flags [.], ack 31857, win 41180, length 0
13:05:14.300652 IP ftp.fi.debian.org.http > 192.168.56.9.48648: Flags [.], ack 238, win 65535, length 1420
13:05:14.301107 IP ftp.fi.debian.org.http > 192.168.56.9.48648: Flags [P.], ack 238, win 65535, length 28
13:05:14.301429 IP lobos.debian.org.http > 192.168.56.9.39941: Flags [.], ack 453, win 65535, length 1420
13:05:14.301720 IP lobos.debian.org.http > 192.168.56.9.39941: Flags [.], ack 453, win 65535, length 1420
13:05:14.301900 IP lobos.debian.org.http > 192.168.56.9.39941: Flags [.], ack 453, win 65535, length 1420
13:05:14.302003 IP 192.168.56.9.48648 > ftp.fi.debian.org.http: Flags [.], ack 33305, win 41180, length 0
13:05:14.302103 IP 192.168.56.9.39941 > lobos.debian.org.http: Flags [.], ack 3948, win 21300, length 0
13:05:14.302371 IP lobos.debian.org.http > 192.168.56.9.39941: Flags [.], ack 453, win 65535, length 1420
13:05:14.302434 IP lobos.debian.org.http > 192.168.56.9.39941: Flags [P.], ack 453, win 65535, length 112
13:05:14.302476 IP 192.168.56.9.39941 > lobos.debian.org.http: Flags [.], ack 6788, win 28400, length 0
13:05:14.307359 IP ftp.fi.debian.org.http > 192.168.56.9.48648: Flags [.], ack 238, win 65535, length 1420
13:05:14.307428 IP ftp.fi.debian.org.http > 192.168.56.9.48648: Flags [.], ack 238, win 65535, length 1420
13:05:14.307491 IP ftp.fi.debian.org.http > 192.168.56.9.48648: Flags [.], ack 238, win 65535, length 1420
13:05:14.307562 IP ftp.fi.debian.org.http > 192.168.56.9.48648: Flags [.], ack 238, win 65535, length 1420
13:05:14.307679 IP ftp.fi.debian.org.http > 192.168.56.9.48648: Flags [.], ack 238, win 65535, length 1420
13:05:14.307745 IP ftp.fi.debian.org.http > 192.168.56.9.48648: Flags [.], ack 238, win 65535, length 1420
13:05:14.307808 IP ftp.fi.debian.org.http > 192.168.56.9.48648: Flags [P.], ack 238, win 65535, length 168
13:05:14.307856 IP 192.168.56.9.48648 > ftp.fi.debian.org.http: Flags [.], ack 36145, win 41180, length 0
13:05:14.308170 IP 192.168.56.9.48648 > ftp.fi.debian.org.http: Flags [.], ack 41993, win 41180, length 0
13:05:14.310625 IP ftp.fi.debian.org.http > 192.168.56.9.48648: Flags [.], ack 238, win 65535, length 1420
13:05:14.310668 IP ftp.fi.debian.org.http > 192.168.56.9.48648: Flags [.], ack 238, win 65535, length 1420
13:05:14.310706 IP ftp.fi.debian.org.http > 192.168.56.9.48648: Flags [.], ack 238, win 65535, length 1420
13:05:14.310791 IP ftp.fi.debian.org.http > 192.168.56.9.48648: Flags [P.], ack 238, win 65535, length 84
13:05:14.311353 IP ftp.fi.debian.org.http > 192.168.56.9.48648: Flags [.], ack 238, win 65535, length 1420
13:05:14.311478 IP ftp.fi.debian.org.http > 192.168.56.9.48648: Flags [.], ack 238, win 65535, length 1420
13:05:14.311549 IP ftp.fi.debian.org.http > 192.168.56.9.48648: Flags [.], ack 238, win 65535, length 1420
13:05:14.311613 IP ftp.fi.debian.org.http > 192.168.56.9.48648: Flags [.], ack 238, win 65535, length 1420
13:05:14.311673 IP ftp.fi.debian.org.http > 192.168.56.9.48648: Flags [P.], ack 238, win 65535, length 112
13:05:14.311742 IP ftp.fi.debian.org.http > 192.168.56.9.48648: Flags [.], ack 238, win 65535, length 1420
13:05:14.311805 IP ftp.fi.debian.org.http > 192.168.56.9.48648: Flags [P.], ack 238, win 65535, length 28
13:05:14.311879 IP ftp.fi.debian.org.http > 192.168.56.9.48648: Flags [.], ack 238, win 65535, length 1420
13:05:14.312026 IP ftp.fi.debian.org.http > 192.168.56.9.48648: Flags [.], ack 238, win 65535, length 1420
13:05:14.312090 IP ftp.fi.debian.org.http > 192.168.56.9.48648: Flags [P.], ack 238, win 65535, length 56
13:05:14.312159 IP ftp.fi.debian.org.http > 192.168.56.9.48648: Flags [.], ack 238, win 65535, length 1420
13:05:14.312224 IP ftp.fi.debian.org.http > 192.168.56.9.48648: Flags [.], ack 238, win 65535, length 1420
13:05:14.312288 IP ftp.fi.debian.org.http > 192.168.56.9.48648: Flags [.], ack 238, win 65535, length 1420
13:05:14.312358 IP ftp.fi.debian.org.http > 192.168.56.9.48648: Flags [.], ack 238, win 65535, length 1420
13:05:14.312420 IP ftp.fi.debian.org.http > 192.168.56.9.48648: Flags [P.], ack 238, win 65535, length 112
13:05:14.312487 IP ftp.fi.debian.org.http > 192.168.56.9.48648: Flags [.], ack 238, win 65535, length 1420
13:05:14.312551 IP ftp.fi.debian.org.http > 192.168.56.9.48648: Flags [P.], ack 238, win 65535, length 28
13:05:14.312625 IP ftp.fi.debian.org.http > 192.168.56.9.48648: Flags [.], ack 238, win 65535, length 1420
13:05:14.312688 IP ftp.fi.debian.org.http > 192.168.56.9.48648: Flags [P.], ack 238, win 65535, length 28
13:05:14.312738 IP 192.168.56.9.48648 > ftp.fi.debian.org.http: Flags [.], ack 44833, win 41180, length 0
13:05:14.312867 IP 192.168.56.9.48648 > ftp.fi.debian.org.http: Flags [.], ack 52129, win 41180, length 0
13:05:14.312920 IP 192.168.56.9.48648 > ftp.fi.debian.org.http: Flags [.], ack 53549, win 44020, length 0
13:05:14.312970 IP 192.168.56.9.48648 > ftp.fi.debian.org.http: Flags [.], ack 54997, win 46860, length 0
13:05:14.313019 IP 192.168.56.9.48648 > ftp.fi.debian.org.http: Flags [.], ack 56417, win 49700, length 0
13:05:14.313068 IP 192.168.56.9.48648 > ftp.fi.debian.org.http: Flags [.], ack 57893, win 51120, length 0
13:05:14.313117 IP 192.168.56.9.48648 > ftp.fi.debian.org.http: Flags [.], ack 63685, win 52540, length 0
13:05:14.313552 IP 192.168.56.9.48648 > ftp.fi.debian.org.http: Flags [.], ack 65133, win 53960, length 0
13:05:14.313939 IP 192.168.56.9.48648 > ftp.fi.debian.org.http: Flags [.], ack 65161, win 53960, length 0
13:05:14.323248 IP ftp.fi.debian.org.http > 192.168.56.9.48648: Flags [.], ack 238, win 65535, length 1420
13:05:14.323454 IP ftp.fi.debian.org.http > 192.168.56.9.48648: Flags [.], ack 238, win 65535, length 1420
13:05:14.323633 IP ftp.fi.debian.org.http > 192.168.56.9.48648: Flags [.], ack 238, win 65535, length 1420
13:05:14.324111 IP ftp.fi.debian.org.http > 192.168.56.9.48648: Flags [.], ack 238, win 65535, length 1420
13:05:14.324255 IP ftp.fi.debian.org.http > 192.168.56.9.48648: Flags [.], ack 238, win 65535, length 1420
13:05:14.324384 IP ftp.fi.debian.org.http > 192.168.56.9.48648: Flags [.], ack 238, win 65535, length 1420
13:05:14.324496 IP ftp.fi.debian.org.http > 192.168.56.9.48648: Flags [P.], ack 238, win 65535, length 168
13:05:14.324606 IP ftp.fi.debian.org.http > 192.168.56.9.48648: Flags [.], ack 238, win 65535, length 1420
13:05:14.324672 IP ftp.fi.debian.org.http > 192.168.56.9.48648: Flags [.], ack 238, win 65535, length 1420
13:05:14.324741 IP ftp.fi.debian.org.http > 192.168.56.9.48648: Flags [.], ack 238, win 65535, length 1420
13:05:14.324796 IP ftp.fi.debian.org.http > 192.168.56.9.48648: Flags [P.], ack 238, win 65535, length 84
13:05:14.324862 IP ftp.fi.debian.org.http > 192.168.56.9.48648: Flags [.], ack 238, win 65535, length 1420
13:05:14.325008 IP ftp.fi.debian.org.http > 192.168.56.9.48648: Flags [P.], ack 238, win 65535, length 28
13:05:14.325092 IP ftp.fi.debian.org.http > 192.168.56.9.48648: Flags [.], ack 238, win 65535, length 1420
13:05:14.325130 IP ftp.fi.debian.org.http > 192.168.56.9.48648: Flags [P.], ack 238, win 65535, length 28
13:05:14.325206 IP 192.168.56.9.48648 > ftp.fi.debian.org.http: Flags [.], ack 68001, win 53960, length 0
13:05:14.325616 IP 192.168.56.9.48648 > ftp.fi.debian.org.http: Flags [.], ack 73681, win 48280, length 0
13:05:14.325752 IP 192.168.56.9.48648 > ftp.fi.debian.org.http: Flags [.], ack 75269, win 53960, length 0
13:05:14.325866 IP 192.168.56.9.48648 > ftp.fi.debian.org.http: Flags [.], ack 78109, win 53960, length 0
13:05:14.326311 IP 192.168.56.9.48648 > ftp.fi.debian.org.http: Flags [.], ack 81089, win 53960, length 0
13:05:14.326672 IP ftp.fi.debian.org.http > 192.168.56.9.48648: Flags [.], ack 238, win 65535, length 1420
13:05:14.326743 IP ftp.fi.debian.org.http > 192.168.56.9.48648: Flags [.], ack 238, win 65535, length 1420
13:05:14.326836 IP ftp.fi.debian.org.http > 192.168.56.9.48648: Flags [P.], ack 238, win 65535, length 56
13:05:14.326911 IP ftp.fi.debian.org.http > 192.168.56.9.48648: Flags [.], ack 238, win 65535, length 1420
13:05:14.326977 IP ftp.fi.debian.org.http > 192.168.56.9.48648: Flags [P.], ack 238, win 65535, length 28
13:05:14.327038 IP ftp.fi.debian.org.http > 192.168.56.9.48648: Flags [.], ack 238, win 65535, length 1420
13:05:14.327118 IP ftp.fi.debian.org.http > 192.168.56.9.48648: Flags [.], ack 238, win 65535, length 1420
13:05:14.327200 IP ftp.fi.debian.org.http > 192.168.56.9.48648: Flags [P.], ack 238, win 65535, length 56
13:05:14.327267 IP ftp.fi.debian.org.http > 192.168.56.9.48648: Flags [.], ack 238, win 65535, length 1420
13:05:14.327340 IP ftp.fi.debian.org.http > 192.168.56.9.48648: Flags [.], ack 238, win 65535, length 1420
13:05:14.327476 IP ftp.fi.debian.org.http > 192.168.56.9.48648: Flags [P.], ack 238, win 65535, length 56
13:05:14.327546 IP ftp.fi.debian.org.http > 192.168.56.9.48648: Flags [.], ack 238, win 65535, length 1420
13:05:14.327583 IP ftp.fi.debian.org.http > 192.168.56.9.48648: Flags [.], ack 238, win 65535, length 1420
13:05:14.327632 IP ftp.fi.debian.org.http > 192.168.56.9.48648: Flags [P.], ack 238, win 65535, length 56
13:05:14.327668 IP ftp.fi.debian.org.http > 192.168.56.9.48648: Flags [.], ack 238, win 65535, length 1420
13:05:14.327704 IP ftp.fi.debian.org.http > 192.168.56.9.48648: Flags [.], ack 238, win 65535, length 1420
13:05:14.327775 IP 192.168.56.9.48648 > ftp.fi.debian.org.http: Flags [.], ack 83929, win 53960, length 0
13:05:14.329511 IP 192.168.56.9.48648 > ftp.fi.debian.org.http: Flags [.], ack 96961, win 53960, length 0
13:05:14.329599 IP ftp.fi.debian.org.http > 192.168.56.9.48648: Flags [P.], ack 238, win 65535, length 56
13:05:14.329669 IP ftp.fi.debian.org.http > 192.168.56.9.48648: Flags [.], ack 238, win 65535, length 1420
13:05:14.329738 IP ftp.fi.debian.org.http > 192.168.56.9.48648: Flags [P.], ack 238, win 65535, length 28
13:05:14.329817 IP ftp.fi.debian.org.http > 192.168.56.9.48648: Flags [.], ack 238, win 65535, length 1420
13:05:14.329886 IP ftp.fi.debian.org.http > 192.168.56.9.48648: Flags [P.], ack 238, win 65535, length 28
13:05:14.329968 IP ftp.fi.debian.org.http > 192.168.56.9.48648: Flags [.], ack 238, win 65535, length 1420
13:05:14.330034 IP ftp.fi.debian.org.http > 192.168.56.9.48648: Flags [.], ack 238, win 65535, length 1420
13:05:14.330103 IP ftp.fi.debian.org.http > 192.168.56.9.48648: Flags [.], ack 238, win 65535, length 1420
13:05:14.330169 IP ftp.fi.debian.org.http > 192.168.56.9.48648: Flags [P.], ack 238, win 65535, length 84
13:05:14.330240 IP ftp.fi.debian.org.http > 192.168.56.9.48648: Flags [.], ack 238, win 65535, length 1420
13:05:14.330310 IP ftp.fi.debian.org.http > 192.168.56.9.48648: Flags [.], ack 238, win 65535, length 1420
13:05:14.330379 IP ftp.fi.debian.org.http > 192.168.56.9.48648: Flags [.], ack 238, win 65535, length 1420
13:05:14.330451 IP ftp.fi.debian.org.http > 192.168.56.9.48648: Flags [.], ack 238, win 65535, length 1420
13:05:14.330531 IP ftp.fi.debian.org.http > 192.168.56.9.48648: Flags [.], ack 238, win 65535, length 1420
13:05:14.330613 IP ftp.fi.debian.org.http > 192.168.56.9.48648: Flags [.], ack 238, win 65535, length 1420
13:05:14.330678 IP ftp.fi.debian.org.http > 192.168.56.9.48648: Flags [.], ack 238, win 65535, length 1420
13:05:14.330743 IP ftp.fi.debian.org.http > 192.168.56.9.48648: Flags [.], ack 238, win 65535, length 1420
13:05:14.330826 IP ftp.fi.debian.org.http > 192.168.56.9.48648: Flags [P.], ack 238, win 65535, length 224
13:05:14.330910 IP ftp.fi.debian.org.http > 192.168.56.9.48648: Flags [P.], ack 238, win 65535, length 646
13:05:14.330992 IP ftp.fi.debian.org.http > 192.168.56.9.48648: Flags [F.], seq 116487, ack 238, win 65535, length 0
13:05:14.331054 IP 192.168.56.9.48648 > ftp.fi.debian.org.http: Flags [.], ack 98437, win 56800, length 0
13:05:14.331211 IP 192.168.56.9.48648 > ftp.fi.debian.org.http: Flags [.], ack 98465, win 56800, length 0
13:05:14.331322 IP 192.168.56.9.48648 > ftp.fi.debian.org.http: Flags [.], ack 99885, win 59640, length 0
13:05:14.331431 IP 192.168.56.9.48648 > ftp.fi.debian.org.http: Flags [.], ack 99913, win 59640, length 0
13:05:14.331539 IP 192.168.56.9.48648 > ftp.fi.debian.org.http: Flags [.], ack 101333, win 62480, length 0
13:05:14.331647 IP 192.168.56.9.48648 > ftp.fi.debian.org.http: Flags [.], ack 102753, win 65320, length 0
13:05:14.331755 IP 192.168.56.9.48648 > ftp.fi.debian.org.http: Flags [.], ack 104173, win 65535, length 0
13:05:14.331863 IP 192.168.56.9.48648 > ftp.fi.debian.org.http: Flags [.], ack 105677, win 65535, length 0
13:05:14.331970 IP 192.168.56.9.48648 > ftp.fi.debian.org.http: Flags [.], ack 107097, win 65535, length 0
13:05:14.332032 IP 192.168.56.9.48648 > ftp.fi.debian.org.http: Flags [.], ack 114197, win 65535, length 0
13:05:14.332140 IP 192.168.56.9.48648 > ftp.fi.debian.org.http: Flags [.], ack 115617, win 65535, length 0
13:05:14.332248 IP 192.168.56.9.48648 > ftp.fi.debian.org.http: Flags [.], ack 115841, win 65535, length 0
13:05:14.332358 IP 192.168.56.9.48648 > ftp.fi.debian.org.http: Flags [.], ack 116487, win 65535, length 0
13:05:14.336661 IP 192.168.56.9.48648 > ftp.fi.debian.org.http: Flags [F.], seq 238, ack 116488, win 65535, length 0
13:05:14.337146 IP 192.168.56.9.48649 > ftp.fi.debian.org.http: Flags [S], seq 493409719, win 14600, options [mss 1460,sackOK,TS val 4294904779 ecr 0,nop,wscale 3], length 0
13:05:14.337703 IP ftp.fi.debian.org.http > 192.168.56.9.48648: Flags [.], ack 239, win 65535, length 0
13:05:14.339774 IP 192.168.56.9.39941 > lobos.debian.org.http: Flags [.], ack 6900, win 28400, length 0
13:05:14.342984 IP lobos.debian.org.http > 192.168.56.9.39941: Flags [.], ack 453, win 65535, length 1420
13:05:14.343268 IP lobos.debian.org.http > 192.168.56.9.39941: Flags [.], ack 453, win 65535, length 1420
13:05:14.343463 IP lobos.debian.org.http > 192.168.56.9.39941: Flags [.], ack 453, win 65535, length 1420
13:05:14.343602 IP lobos.debian.org.http > 192.168.56.9.39941: Flags [P.], ack 453, win 65535, length 84
13:05:14.343708 IP lobos.debian.org.http > 192.168.56.9.39941: Flags [.], ack 453, win 65535, length 1420
13:05:14.343791 IP lobos.debian.org.http > 192.168.56.9.39941: Flags [.], ack 453, win 65535, length 1420
13:05:14.343859 IP lobos.debian.org.http > 192.168.56.9.39941: Flags [P.], ack 453, win 65535, length 56
13:05:14.344307 IP 192.168.56.9.39941 > lobos.debian.org.http: Flags [.], ack 8320, win 31240, length 0
13:05:14.344583 IP 192.168.56.9.39941 > lobos.debian.org.http: Flags [.], ack 9740, win 34080, length 0
13:05:14.344692 IP 192.168.56.9.39941 > lobos.debian.org.http: Flags [.], ack 11160, win 36920, length 0
13:05:14.344794 IP 192.168.56.9.39941 > lobos.debian.org.http: Flags [.], ack 11244, win 36920, length 0
13:05:14.344895 IP 192.168.56.9.39941 > lobos.debian.org.http: Flags [.], ack 12664, win 38340, length 0
13:05:14.344997 IP 192.168.56.9.39941 > lobos.debian.org.http: Flags [.], ack 14140, win 39760, length 0
13:05:14.345182 IP lobos.debian.org.http > 192.168.56.9.39941: Flags [.], ack 453, win 65535, length 1420
13:05:14.345217 IP lobos.debian.org.http > 192.168.56.9.39941: Flags [P.], ack 453, win 65535, length 28
13:05:14.345291 IP 192.168.56.9.39941 > lobos.debian.org.http: Flags [.], ack 15560, win 41180, length 0
13:05:14.345458 IP 192.168.56.9.39941 > lobos.debian.org.http: Flags [.], ack 15588, win 41180, length 0
13:05:14.351709 IP ftp.fi.debian.org.http > 192.168.56.9.48649: Flags [S.], seq 49792001, ack 493409720, win 65535, options [mss 1460], length 0
13:05:14.353002 IP 192.168.56.9.48649 > ftp.fi.debian.org.http: Flags [.], ack 1, win 14600, length 0
13:05:14.354251 IP 192.168.56.9.48649 > ftp.fi.debian.org.http: Flags [P.], ack 1, win 14600, length 229
13:05:14.355006 IP ftp.fi.debian.org.http > 192.168.56.9.48649: Flags [.], ack 230, win 65535, length 0
13:05:14.366134 IP ftp.fi.debian.org.http > 192.168.56.9.48649: Flags [P.], ack 230, win 65535, length 139
13:05:14.368803 IP ftp.fi.debian.org.http > 192.168.56.9.48649: Flags [F.], seq 140, ack 230, win 65535, length 0
13:05:14.369783 IP 192.168.56.9.48649 > ftp.fi.debian.org.http: Flags [.], ack 140, win 15544, length 0
13:05:14.370404 IP 192.168.56.9.48649 > ftp.fi.debian.org.http: Flags [F.], seq 230, ack 141, win 15544, length 0
13:05:14.370979 IP 192.168.56.9.48650 > ftp.fi.debian.org.http: Flags [S], seq 1344540965, win 14600, options [mss 1460,sackOK,TS val 4294904787 ecr 0,nop,wscale 3], length 0
13:05:14.371468 IP ftp.fi.debian.org.http > 192.168.56.9.48649: Flags [.], ack 231, win 65535, length 0
13:05:14.385462 IP ftp.fi.debian.org.http > 192.168.56.9.48650: Flags [S.], seq 49856001, ack 1344540966, win 65535, options [mss 1460], length 0
13:05:14.387181 IP 192.168.56.9.48650 > ftp.fi.debian.org.http: Flags [.], ack 1, win 14600, length 0
13:05:14.388616 IP 192.168.56.9.48650 > ftp.fi.debian.org.http: Flags [P.], ack 1, win 14600, length 235
13:05:14.389386 IP ftp.fi.debian.org.http > 192.168.56.9.48650: Flags [.], ack 236, win 65535, length 0
13:05:14.389900 IP lobos.debian.org.http > 192.168.56.9.39941: Flags [.], ack 453, win 65535, length 1420
13:05:14.389900 IP lobos.debian.org.http > 192.168.56.9.39941: Flags [.], ack 453, win 65535, length 1420
13:05:14.389900 IP lobos.debian.org.http > 192.168.56.9.39941: Flags [.], ack 453, win 65535, length 1420
13:05:14.390937 IP lobos.debian.org.http > 192.168.56.9.39941: Flags [P.], ack 453, win 65535, length 84
13:05:14.390984 IP lobos.debian.org.http > 192.168.56.9.39941: Flags [.], ack 453, win 65535, length 1420
13:05:14.391028 IP lobos.debian.org.http > 192.168.56.9.39941: Flags [.], ack 453, win 65535, length 1420
13:05:14.391072 IP lobos.debian.org.http > 192.168.56.9.39941: Flags [.], ack 453, win 65535, length 1420
13:05:14.391115 IP lobos.debian.org.http > 192.168.56.9.39941: Flags [.], ack 453, win 65535, length 1420
13:05:14.391158 IP lobos.debian.org.http > 192.168.56.9.39941: Flags [.], ack 453, win 65535, length 1420
13:05:14.391198 IP lobos.debian.org.http > 192.168.56.9.39941: Flags [P.], ack 453, win 65535, length 140
13:05:14.391267 IP 192.168.56.9.39941 > lobos.debian.org.http: Flags [.], ack 18428, win 41180, length 0
13:05:14.391537 IP 192.168.56.9.39941 > lobos.debian.org.http: Flags [.], ack 19932, win 41180, length 0
13:05:14.392107 IP 192.168.56.9.39941 > lobos.debian.org.http: Flags [.], ack 27172, win 41180, length 0
13:05:14.400515 IP ftp.fi.debian.org.http > 192.168.56.9.48650: Flags [P.], ack 236, win 65535, length 139
13:05:14.400625 IP ftp.fi.debian.org.http > 192.168.56.9.48650: Flags [F.], seq 140, ack 236, win 65535, length 0
13:05:14.400857 IP 192.168.56.9.48650 > ftp.fi.debian.org.http: Flags [.], ack 140, win 15544, length 0
13:05:14.401364 IP 192.168.56.9.48650 > ftp.fi.debian.org.http: Flags [F.], seq 236, ack 141, win 15544, length 0
13:05:14.401720 IP 192.168.56.9.48651 > ftp.fi.debian.org.http: Flags [S], seq 666966443, win 14600, options [mss 1460,sackOK,TS val 4294904795 ecr 0,nop,wscale 3], length 0
13:05:14.402099 IP ftp.fi.debian.org.http > 192.168.56.9.48650: Flags [.], ack 237, win 65535, length 0
13:05:14.412952 IP ftp.fi.debian.org.http > 192.168.56.9.48651: Flags [S.], seq 49920001, ack 666966444, win 65535, options [mss 1460], length 0
13:05:14.413965 IP 192.168.56.9.48651 > ftp.fi.debian.org.http: Flags [.], ack 1, win 14600, length 0
13:05:14.414803 IP 192.168.56.9.48651 > ftp.fi.debian.org.http: Flags [P.], ack 1, win 14600, length 234
13:05:14.415264 IP ftp.fi.debian.org.http > 192.168.56.9.48651: Flags [.], ack 235, win 65535, length 0
13:05:14.431024 IP ftp.fi.debian.org.http > 192.168.56.9.48651: Flags [P.], ack 235, win 65535, length 139
13:05:14.431903 IP ftp.fi.debian.org.http > 192.168.56.9.48651: Flags [F.], seq 140, ack 235, win 65535, length 0
13:05:14.436885 IP 192.168.56.9.48651 > ftp.fi.debian.org.http: Flags [.], ack 140, win 15544, length 0
13:05:14.437634 IP 192.168.56.9.48651 > ftp.fi.debian.org.http: Flags [F.], seq 235, ack 141, win 15544, length 0
13:05:14.438182 IP 192.168.56.9.48652 > ftp.fi.debian.org.http: Flags [S], seq 1448691548, win 14600, options [mss 1460,sackOK,TS val 4294904803 ecr 0,nop,wscale 3], length 0
13:05:14.438672 IP lobos.debian.org.http > 192.168.56.9.39941: Flags [.], ack 453, win 65535, length 1420
13:05:14.438863 IP lobos.debian.org.http > 192.168.56.9.39941: Flags [.], ack 453, win 65535, length 1420
13:05:14.438988 IP lobos.debian.org.http > 192.168.56.9.39941: Flags [.], ack 453, win 65535, length 1420
13:05:14.439071 IP lobos.debian.org.http > 192.168.56.9.39941: Flags [.], ack 453, win 65535, length 1420
13:05:14.439124 IP lobos.debian.org.http > 192.168.56.9.39941: Flags [.], ack 453, win 65535, length 1420
13:05:14.439160 IP lobos.debian.org.http > 192.168.56.9.39941: Flags [P.], ack 453, win 65535, length 140
13:05:14.439183 IP ftp.fi.debian.org.http > 192.168.56.9.48651: Flags [.], ack 236, win 65535, length 0
13:05:14.439198 IP lobos.debian.org.http > 192.168.56.9.39941: Flags [.], ack 453, win 65535, length 1420
13:05:14.439208 IP lobos.debian.org.http > 192.168.56.9.39941: Flags [.], ack 453, win 65535, length 1420
13:05:14.439215 IP lobos.debian.org.http > 192.168.56.9.39941: Flags [.], ack 453, win 65535, length 1420
13:05:14.439219 IP lobos.debian.org.http > 192.168.56.9.39941: Flags [.], ack 453, win 65535, length 1420
13:05:14.439222 IP lobos.debian.org.http > 192.168.56.9.39941: Flags [P.], ack 453, win 65535, length 112
13:05:14.439224 IP lobos.debian.org.http > 192.168.56.9.39941: Flags [.], ack 453, win 65535, length 1420
13:05:14.439225 IP lobos.debian.org.http > 192.168.56.9.39941: Flags [P.], ack 453, win 65535, length 28
13:05:14.439226 IP 192.168.56.9.39941 > lobos.debian.org.http: Flags [.], ack 30012, win 41180, length 0
13:05:14.439227 IP lobos.debian.org.http > 192.168.56.9.39941: Flags [.], ack 453, win 65535, length 1420
13:05:14.439227 IP lobos.debian.org.http > 192.168.56.9.39941: Flags [.], ack 453, win 65535, length 1420
13:05:14.439227 IP lobos.debian.org.http > 192.168.56.9.39941: Flags [.], ack 453, win 65535, length 1420
13:05:14.439227 IP lobos.debian.org.http > 192.168.56.9.39941: Flags [P.], ack 453, win 65535, length 84
13:05:14.439228 IP lobos.debian.org.http > 192.168.56.9.39941: Flags [.], ack 453, win 65535, length 1420
13:05:14.439329 IP lobos.debian.org.http > 192.168.56.9.39941: Flags [.], ack 453, win 65535, length 1420
13:05:14.439413 IP lobos.debian.org.http > 192.168.56.9.39941: Flags [P.], ack 453, win 65535, length 56
13:05:14.439745 IP 192.168.56.9.39941 > lobos.debian.org.http: Flags [.], ack 48892, win 41180, length 0
13:05:14.450392 IP ftp.fi.debian.org.http > 192.168.56.9.48652: Flags [S.], seq 49984001, ack 1448691549, win 65535, options [mss 1460], length 0
13:05:14.450925 IP 192.168.56.9.48652 > ftp.fi.debian.org.http: Flags [.], ack 1, win 14600, length 0
13:05:14.451451 IP 192.168.56.9.48652 > ftp.fi.debian.org.http: Flags [P.], ack 1, win 14600, length 237
13:05:14.452073 IP ftp.fi.debian.org.http > 192.168.56.9.48652: Flags [.], ack 238, win 65535, length 0
13:05:14.461896 IP ftp.fi.debian.org.http > 192.168.56.9.48652: Flags [P.], ack 238, win 65535, length 261
13:05:14.463157 IP ftp.fi.debian.org.http > 192.168.56.9.48652: Flags [F.], seq 262, ack 238, win 65535, length 0
13:05:14.464006 IP 192.168.56.9.48652 > ftp.fi.debian.org.http: Flags [.], ack 262, win 15544, length 0
13:05:14.465067 IP 192.168.56.9.48652 > ftp.fi.debian.org.http: Flags [F.], seq 238, ack 263, win 15544, length 0
13:05:14.469869 IP ftp.fi.debian.org.http > 192.168.56.9.48652: Flags [.], ack 239, win 65535, length 0
13:05:14.472648 IP 192.168.56.9.48653 > ftp.fi.debian.org.http: Flags [S], seq 4291746928, win 14600, options [mss 1460,sackOK,TS val 4294904813 ecr 0,nop,wscale 3], length 0
13:05:14.477672 IP lobos.debian.org.http > 192.168.56.9.39941: Flags [.], ack 453, win 65535, length 1420
13:05:14.478244 IP lobos.debian.org.http > 192.168.56.9.39941: Flags [.], ack 453, win 65535, length 1420
13:05:14.478619 IP lobos.debian.org.http > 192.168.56.9.39941: Flags [.], ack 453, win 65535, length 1420
13:05:14.478866 IP lobos.debian.org.http > 192.168.56.9.39941: Flags [.], ack 453, win 65535, length 1420
13:05:14.479100 IP lobos.debian.org.http > 192.168.56.9.39941: Flags [.], ack 453, win 65535, length 1420
13:05:14.479285 IP lobos.debian.org.http > 192.168.56.9.39941: Flags [P.], ack 453, win 65535, length 140
13:05:14.479421 IP lobos.debian.org.http > 192.168.56.9.39941: Flags [.], ack 453, win 65535, length 1420
13:05:14.479536 IP lobos.debian.org.http > 192.168.56.9.39941: Flags [P.], ack 453, win 65535, length 28
13:05:14.479622 IP 192.168.56.9.39941 > lobos.debian.org.http: Flags [.], ack 51732, win 41180, length 0
13:05:14.481023 IP 192.168.56.9.39941 > lobos.debian.org.http: Flags [.], ack 57580, win 41180, length 0
13:05:14.481447 IP lobos.debian.org.http > 192.168.56.9.39941: Flags [.], ack 453, win 65535, length 1420
13:05:14.481553 IP lobos.debian.org.http > 192.168.56.9.39941: Flags [.], ack 453, win 65535, length 1420
13:05:14.481657 IP lobos.debian.org.http > 192.168.56.9.39941: Flags [.], ack 453, win 65535, length 1420
13:05:14.481765 IP lobos.debian.org.http > 192.168.56.9.39941: Flags [.], ack 453, win 65535, length 1420
13:05:14.481859 IP lobos.debian.org.http > 192.168.56.9.39941: Flags [.], ack 453, win 65535, length 1420
13:05:14.481970 IP lobos.debian.org.http > 192.168.56.9.39941: Flags [.], ack 453, win 65535, length 1420
13:05:14.482082 IP lobos.debian.org.http > 192.168.56.9.39941: Flags [.], ack 453, win 65535, length 1420
13:05:14.482170 IP lobos.debian.org.http > 192.168.56.9.39941: Flags [P.], ack 453, win 65535, length 196
13:05:14.482268 IP lobos.debian.org.http > 192.168.56.9.39941: Flags [.], ack 453, win 65535, length 1420
13:05:14.482364 IP lobos.debian.org.http > 192.168.56.9.39941: Flags [P.], ack 453, win 65535, length 28
13:05:14.482434 IP 192.168.56.9.39941 > lobos.debian.org.http: Flags [.], ack 60420, win 44020, length 0
13:05:14.483060 IP 192.168.56.9.39941 > lobos.debian.org.http: Flags [.], ack 61840, win 46860, length 0
13:05:14.486449 IP 192.168.56.9.39941 > lobos.debian.org.http: Flags [.], ack 63260, win 49700, length 0
13:05:14.487303 IP 192.168.56.9.39941 > lobos.debian.org.http: Flags [.], ack 64680, win 52540, length 0
13:05:14.488041 IP 192.168.56.9.39941 > lobos.debian.org.http: Flags [.], ack 66100, win 56800, length 0
13:05:14.488510 IP 192.168.56.9.39941 > lobos.debian.org.http: Flags [.], ack 67520, win 59640, length 0
13:05:14.488849 IP 192.168.56.9.39941 > lobos.debian.org.http: Flags [.], ack 67716, win 62480, length 0
13:05:14.489057 IP 192.168.56.9.39941 > lobos.debian.org.http: Flags [.], ack 69136, win 65320, length 0
13:05:14.489161 IP 192.168.56.9.39941 > lobos.debian.org.http: Flags [.], ack 69164, win 65320, length 0
13:05:14.489263 IP lobos.debian.org.http > 192.168.56.9.39941: Flags [.], ack 453, win 65535, length 1420
13:05:14.489361 IP lobos.debian.org.http > 192.168.56.9.39941: Flags [.], ack 453, win 65535, length 1420
13:05:14.489443 IP lobos.debian.org.http > 192.168.56.9.39941: Flags [P.], ack 453, win 65535, length 56
13:05:14.489548 IP lobos.debian.org.http > 192.168.56.9.39941: Flags [.], ack 453, win 65535, length 1420
13:05:14.489654 IP lobos.debian.org.http > 192.168.56.9.39941: Flags [.], ack 453, win 65535, length 1420
13:05:14.489697 IP lobos.debian.org.http > 192.168.56.9.39941: Flags [.], ack 453, win 65535, length 1420
13:05:14.489739 IP lobos.debian.org.http > 192.168.56.9.39941: Flags [.], ack 453, win 65535, length 1420
13:05:14.489786 IP lobos.debian.org.http > 192.168.56.9.39941: Flags [.], ack 453, win 65535, length 1420
13:05:14.489852 IP lobos.debian.org.http > 192.168.56.9.39941: Flags [P.], ack 453, win 65535, length 140
13:05:14.489904 IP lobos.debian.org.http > 192.168.56.9.39941: Flags [.], ack 453, win 65535, length 1420
13:05:14.489945 IP lobos.debian.org.http > 192.168.56.9.39941: Flags [.], ack 453, win 65535, length 1420
13:05:14.489990 IP lobos.debian.org.http > 192.168.56.9.39941: Flags [P.], ack 453, win 65535, length 56
13:05:14.490026 IP lobos.debian.org.http > 192.168.56.9.39941: Flags [.], ack 453, win 65535, length 1420
13:05:14.490071 IP lobos.debian.org.http > 192.168.56.9.39941: Flags [P.], ack 453, win 65535, length 28
13:05:14.490122 IP ftp.fi.debian.org.http > 192.168.56.9.48653: Flags [S.], seq 50048001, ack 4291746929, win 65535, options [mss 1460], length 0
13:05:14.490203 IP 192.168.56.9.39941 > lobos.debian.org.http: Flags [.], ack 70584, win 65535, length 0
13:05:14.490427 IP 192.168.56.9.39941 > lobos.debian.org.http: Flags [.], ack 72004, win 65535, length 0
13:05:14.490554 IP 192.168.56.9.39941 > lobos.debian.org.http: Flags [.], ack 73480, win 65535, length 0
13:05:14.490669 IP 192.168.56.9.39941 > lobos.debian.org.http: Flags [.], ack 74900, win 65535, length 0
13:05:14.490774 IP 192.168.56.9.39941 > lobos.debian.org.http: Flags [.], ack 76320, win 65535, length 0
13:05:14.490888 IP 192.168.56.9.48653 > ftp.fi.debian.org.http: Flags [.], ack 1, win 14600, length 0
13:05:14.490999 IP 192.168.56.9.48653 > ftp.fi.debian.org.http: Flags [P.], ack 1, win 14600, length 243
13:05:14.491232 IP 192.168.56.9.39941 > lobos.debian.org.http: Flags [.], ack 83644, win 65535, length 0
13:05:14.491442 IP ftp.fi.debian.org.http > 192.168.56.9.48653: Flags [.], ack 244, win 65535, length 0
13:05:14.504397 IP ftp.fi.debian.org.http > 192.168.56.9.48653: Flags [P.], ack 244, win 65535, length 261
13:05:14.505399 IP 192.168.56.9.48653 > ftp.fi.debian.org.http: Flags [.], ack 262, win 15544, length 0
13:05:14.506048 IP 192.168.56.9.48653 > ftp.fi.debian.org.http: Flags [F.], seq 244, ack 262, win 15544, length 0
13:05:14.506794 IP 192.168.56.9.48654 > ftp.fi.debian.org.http: Flags [S], seq 3626199425, win 14600, options [mss 1460,sackOK,TS val 4294904821 ecr 0,nop,wscale 3], length 0
13:05:14.508698 IP ftp.fi.debian.org.http > 192.168.56.9.48653: Flags [F.], seq 262, ack 244, win 65535, length 0
13:05:14.508768 IP ftp.fi.debian.org.http > 192.168.56.9.48653: Flags [F.], seq 262, ack 245, win 65535, length 0
13:05:14.509378 IP 192.168.56.9.48653 > ftp.fi.debian.org.http: Flags [.], ack 263, win 15544, length 0
13:05:14.520267 IP ftp.fi.debian.org.http > 192.168.56.9.48654: Flags [S.], seq 50112001, ack 3626199426, win 65535, options [mss 1460], length 0
13:05:14.520944 IP 192.168.56.9.48654 > ftp.fi.debian.org.http: Flags [.], ack 1, win 14600, length 0
13:05:14.522187 IP 192.168.56.9.48654 > ftp.fi.debian.org.http: Flags [P.], ack 1, win 14600, length 242
13:05:14.522616 IP ftp.fi.debian.org.http > 192.168.56.9.48654: Flags [.], ack 243, win 65535, length 0
13:05:14.525951 IP lobos.debian.org.http > 192.168.56.9.39941: Flags [.], ack 453, win 65535, length 1420
13:05:14.526014 IP lobos.debian.org.http > 192.168.56.9.39941: Flags [.], ack 453, win 65535, length 1420
13:05:14.526127 IP lobos.debian.org.http > 192.168.56.9.39941: Flags [.], ack 453, win 65535, length 1420
13:05:14.526168 IP lobos.debian.org.http > 192.168.56.9.39941: Flags [.], ack 453, win 65535, length 1420
13:05:14.526212 IP lobos.debian.org.http > 192.168.56.9.39941: Flags [.], ack 453, win 65535, length 1420
13:05:14.526256 IP lobos.debian.org.http > 192.168.56.9.39941: Flags [.], ack 453, win 65535, length 1420
13:05:14.526299 IP lobos.debian.org.http > 192.168.56.9.39941: Flags [.], ack 453, win 65535, length 1420
13:05:14.526340 IP lobos.debian.org.http > 192.168.56.9.39941: Flags [.], ack 453, win 65535, length 1420
13:05:14.526381 IP lobos.debian.org.http > 192.168.56.9.39941: Flags [.], ack 453, win 65535, length 1420
13:05:14.526416 IP lobos.debian.org.http > 192.168.56.9.39941: Flags [.], ack 453, win 65535, length 1420
13:05:14.526455 IP lobos.debian.org.http > 192.168.56.9.39941: Flags [P.], ack 453, win 65535, length 280
13:05:14.526500 IP lobos.debian.org.http > 192.168.56.9.39941: Flags [.], ack 453, win 65535, length 1420
13:05:14.526535 IP lobos.debian.org.http > 192.168.56.9.39941: Flags [.], ack 453, win 65535, length 1420
13:05:14.526569 IP lobos.debian.org.http > 192.168.56.9.39941: Flags [.], ack 453, win 65535, length 1420
13:05:14.526614 IP lobos.debian.org.http > 192.168.56.9.39941: Flags [P.], ack 453, win 65535, length 1267
13:05:14.526745 IP 192.168.56.9.39941 > lobos.debian.org.http: Flags [.], ack 85064, win 65535, length 0
13:05:14.526855 IP 192.168.56.9.39941 > lobos.debian.org.http: Flags [.], ack 86484, win 65535, length 0
13:05:14.527207 IP 192.168.56.9.39941 > lobos.debian.org.http: Flags [.], ack 103651, win 65535, length 0
13:05:14.538507 IP ftp.fi.debian.org.http > 192.168.56.9.48654: Flags [P.], ack 243, win 65535, length 261
13:05:14.538835 IP ftp.fi.debian.org.http > 192.168.56.9.48654: Flags [F.], seq 262, ack 243, win 65535, length 0
13:05:14.540518 IP 192.168.56.9.48654 > ftp.fi.debian.org.http: Flags [.], ack 262, win 15544, length 0
13:05:14.540789 IP 192.168.56.9.48654 > ftp.fi.debian.org.http: Flags [F.], seq 243, ack 263, win 15544, length 0
13:05:14.541072 IP ftp.fi.debian.org.http > 192.168.56.9.48654: Flags [.], ack 244, win 65535, length 0
13:05:14.555719 IP 192.168.56.9.39941 > lobos.debian.org.http: Flags [P.], ack 103651, win 65535, length 232
13:05:14.557025 IP lobos.debian.org.http > 192.168.56.9.39941: Flags [.], ack 685, win 65535, length 0
13:05:14.601267 IP lobos.debian.org.http > 192.168.56.9.39941: Flags [.], ack 685, win 65535, length 1420
13:05:14.602122 IP lobos.debian.org.http > 192.168.56.9.39941: Flags [.], ack 685, win 65535, length 1420
13:05:14.603103 IP lobos.debian.org.http > 192.168.56.9.39941: Flags [.], ack 685, win 65535, length 1420
13:05:14.603784 IP lobos.debian.org.http > 192.168.56.9.39941: Flags [.], ack 685, win 65535, length 1420
13:05:14.604252 IP lobos.debian.org.http > 192.168.56.9.39941: Flags [.], ack 685, win 65535, length 1420
13:05:14.604591 IP lobos.debian.org.http > 192.168.56.9.39941: Flags [.], ack 685, win 65535, length 1420
13:05:14.604727 IP lobos.debian.org.http > 192.168.56.9.39941: Flags [.], ack 685, win 65535, length 1420
13:05:14.604824 IP lobos.debian.org.http > 192.168.56.9.39941: Flags [P.], ack 685, win 65535, length 1192
13:05:14.606144 IP 192.168.56.9.39941 > lobos.debian.org.http: Flags [.], ack 106491, win 65535, length 0
13:05:14.606462 IP 192.168.56.9.39941 > lobos.debian.org.http: Flags [.], ack 114783, win 65535, length 0
13:05:14.610706 IP 192.168.56.9.39941 > lobos.debian.org.http: Flags [P.], ack 114783, win 65535, length 238
13:05:14.612304 IP lobos.debian.org.http > 192.168.56.9.39941: Flags [.], ack 923, win 65535, length 0
13:05:14.654321 IP lobos.debian.org.http > 192.168.56.9.39941: Flags [.], ack 923, win 65535, length 1420
13:05:14.657106 IP lobos.debian.org.http > 192.168.56.9.39941: Flags [.], ack 923, win 65535, length 1420
13:05:14.658094 IP lobos.debian.org.http > 192.168.56.9.39941: Flags [.], ack 923, win 65535, length 1420
13:05:14.658742 IP lobos.debian.org.http > 192.168.56.9.39941: Flags [.], ack 923, win 65535, length 1420
13:05:14.659277 IP lobos.debian.org.http > 192.168.56.9.39941: Flags [.], ack 923, win 65535, length 1420
13:05:14.659638 IP lobos.debian.org.http > 192.168.56.9.39941: Flags [.], ack 923, win 65535, length 1420
13:05:14.659952 IP lobos.debian.org.http > 192.168.56.9.39941: Flags [.], ack 923, win 65535, length 1420
13:05:14.660216 IP lobos.debian.org.http > 192.168.56.9.39941: Flags [.], ack 923, win 65535, length 1420
13:05:14.660589 IP lobos.debian.org.http > 192.168.56.9.39941: Flags [.], ack 923, win 65535, length 1420
13:05:14.660754 IP lobos.debian.org.http > 192.168.56.9.39941: Flags [.], ack 923, win 65535, length 1420
13:05:14.660905 IP lobos.debian.org.http > 192.168.56.9.39941: Flags [P.], ack 923, win 65535, length 477
13:05:14.661042 IP 192.168.56.9.39941 > lobos.debian.org.http: Flags [.], ack 117623, win 65535, length 0
13:05:14.661224 IP 192.168.56.9.39941 > lobos.debian.org.http: Flags [.], ack 129460, win 65535, length 0
13:05:14.662456 IP 192.168.56.9.39941 > lobos.debian.org.http: Flags [P.], ack 129460, win 65535, length 237
13:05:14.663402 IP lobos.debian.org.http > 192.168.56.9.39941: Flags [.], ack 1160, win 65535, length 0
13:05:14.706602 IP lobos.debian.org.http > 192.168.56.9.39941: Flags [.], ack 1160, win 65535, length 1420
13:05:14.707602 IP lobos.debian.org.http > 192.168.56.9.39941: Flags [.], ack 1160, win 65535, length 1420
13:05:14.708619 IP lobos.debian.org.http > 192.168.56.9.39941: Flags [.], ack 1160, win 65535, length 1420
13:05:14.709246 IP lobos.debian.org.http > 192.168.56.9.39941: Flags [.], ack 1160, win 65535, length 1420
13:05:14.709621 IP lobos.debian.org.http > 192.168.56.9.39941: Flags [.], ack 1160, win 65535, length 1420
13:05:14.710083 IP lobos.debian.org.http > 192.168.56.9.39941: Flags [.], ack 1160, win 65535, length 1420
13:05:14.710397 IP lobos.debian.org.http > 192.168.56.9.39941: Flags [.], ack 1160, win 65535, length 1420
13:05:14.710622 IP lobos.debian.org.http > 192.168.56.9.39941: Flags [.], ack 1160, win 65535, length 1420
13:05:14.710790 IP lobos.debian.org.http > 192.168.56.9.39941: Flags [P.], ack 1160, win 65535, length 267
13:05:14.711535 IP 192.168.56.9.39941 > lobos.debian.org.http: Flags [.], ack 132300, win 65535, length 0
13:05:14.712030 IP 192.168.56.9.39941 > lobos.debian.org.http: Flags [.], ack 141087, win 65535, length 0
13:05:14.727884 IP 192.168.56.9.39941 > lobos.debian.org.http: Flags [F.], seq 1160, ack 141087, win 65535, length 0
13:05:14.728637 IP lobos.debian.org.http > 192.168.56.9.39941: Flags [.], ack 1161, win 65535, length 0
13:05:14.771322 IP lobos.debian.org.http > 192.168.56.9.39941: Flags [F.], seq 141087, ack 1161, win 65535, length 0
13:05:14.772828 IP 192.168.56.9.39941 > lobos.debian.org.http: Flags [.], ack 141088, win 18244, length 0
13:05:21.452106 IP 192.168.56.1.49477 > pfSense.localdomain.ssh: Flags [.], ack 384, win 8354, options [nop,nop,TS val 755052561 ecr 2533044210], length 0
13:05:21.453765 IP pfSense.localdomain.ssh > 192.168.56.1.49477: Flags [P.], ack 65, win 520, options [nop,nop,TS val 2533044210 ecr 755022623], length 64
13:05:21.454397 IP 192.168.56.1.49477 > pfSense.localdomain.ssh: Flags [P.], ack 384, win 8358, options [nop,nop,TS val 755052561 ecr 2533044210], length 32
13:05:21.455153 IP pfSense.localdomain.ssh > 192.168.56.1.49477: Flags [.], ack 97, win 520, options [nop,nop,TS val 2533044210 ecr 755052561], length 0
13:05:24.887584 IP pfSense.localdomain.ssh > 192.168.56.1.49996: Flags [P.], ack 109, win 520, options [nop,nop,TS val 706151916 ecr 755026038], length 68
13:05:24.889982 IP 192.168.56.1.49996 > pfSense.localdomain.ssh: Flags [.], ack 272, win 8187, options [nop,nop,TS val 755055973 ecr 706151916], length 0
13:05:24.890662 IP 192.168.56.1.49996 > pfSense.localdomain.ssh: Flags [P.], ack 272, win 8192, options [nop,nop,TS val 755055973 ecr 706151916], length 36
13:05:24.891046 IP pfSense.localdomain.ssh > 192.168.56.1.49996: Flags [.], ack 145, win 520, options [nop,nop,TS val 706151916 ecr 755055973], length 0
13:05:32.543408 IP 192.168.56.9.ntp > maukkaat.tontut.fi.ntp: NTPv4, Client, length 48
13:05:32.567156 IP maukkaat.tontut.fi.ntp > 192.168.56.9.ntp: NTPv4, Server, length 48
13:05:33.545994 IP 192.168.56.9.ntp > sigma.baytems.com.ntp: NTPv4, Client, length 48
13:05:33.563806 IP sigma.baytems.com.ntp > 192.168.56.9.ntp: NTPv4, Server, length 48
13:05:37.555353 ARP, Request who-has pfSense.localdomain tell 192.168.56.9, length 46
13:05:37.556272 ARP, Reply pfSense.localdomain is-at 08:00:27:83:6d:03 (oui Unknown), length 28
13:05:49.214697 IP 192.168.56.9.41811 > vm0004.panoulu.local.domain: 47554+ A? google.fi. (27)
13:05:49.258560 IP vm0004.panoulu.local.domain > 192.168.56.9.41811: 47554 3/4/4 A 173.194.32.56,[|domain]
13:05:49.263389 IP 192.168.56.9 > arn06s02-in-f24.1e100.net: ICMP echo request, id 2949, seq 1, length 64
13:05:49.272971 IP arn06s02-in-f24.1e100.net > 192.168.56.9: ICMP echo reply, id 2949, seq 1, length 64
13:05:49.274547 IP 192.168.56.9.47843 > vm0004.panoulu.local.domain: 28554+ PTR? 56.32.194.173.in-addr.arpa. (44)
13:05:49.296527 IP vm0004.panoulu.local.domain > 192.168.56.9.47843: 28554 1/4/4 (229)
13:05:50.265034 IP 192.168.56.9 > arn06s02-in-f24.1e100.net: ICMP echo request, id 2949, seq 2, length 64
13:05:51.270264 IP 192.168.56.9 > arn06s02-in-f24.1e100.net: ICMP echo request, id 2949, seq 3, length 64
13:05:51.285444 IP arn06s02-in-f24.1e100.net > 192.168.56.9: ICMP echo reply, id 2949, seq 3, length 64
13:05:51.286596 IP 192.168.56.9.44893 > vm0004.panoulu.local.domain: 23163+ PTR? 56.32.194.173.in-addr.arpa. (44)
13:05:51.289441 IP vm0004.panoulu.local.domain > 192.168.56.9.44893: 23163 1/4/4 (229)
13:05:51.488848 IP pfSense.localdomain.ssh > 192.168.56.1.49477: Flags [P.], ack 97, win 520, options [nop,nop,TS val 2533047211 ecr 755052561], length 64
13:05:51.490692 IP 192.168.56.1.49477 > pfSense.localdomain.ssh: Flags [.], ack 448, win 8354, options [nop,nop,TS val 755082525 ecr 2533047211], length 0
13:05:51.491312 IP 192.168.56.1.49477 > pfSense.localdomain.ssh: Flags [P.], ack 448, win 8358, options [nop,nop,TS val 755082525 ecr 2533047211], length 32
13:05:51.491600 IP pfSense.localdomain.ssh > 192.168.56.1.49477: Flags [.], ack 129, win 520, options [nop,nop,TS val 2533047211 ecr 755082525], length 0
13:05:52.273001 IP 192.168.56.9 > arn06s02-in-f24.1e100.net: ICMP echo request, id 2949, seq 4, length 64
13:05:52.291728 IP arn06s02-in-f24.1e100.net > 192.168.56.9: ICMP echo reply, id 2949, seq 4, length 64
13:05:52.293466 IP 192.168.56.9.37564 > vm0004.panoulu.local.domain: 35491+ PTR? 56.32.194.173.in-addr.arpa. (44)
13:05:52.296945 IP vm0004.panoulu.local.domain > 192.168.56.9.37564: 35491 1/4/4 (229)
13:05:53.276489 IP 192.168.56.9 > arn06s02-in-f24.1e100.net: ICMP echo request, id 2949, seq 5, length 64
13:05:53.293411 IP arn06s02-in-f24.1e100.net > 192.168.56.9: ICMP echo reply, id 2949, seq 5, length 64
13:05:53.295844 IP 192.168.56.9.38668 > vm0004.panoulu.local.domain: 32940+ PTR? 56.32.194.173.in-addr.arpa. (44)
13:05:53.298181 IP vm0004.panoulu.local.domain > 192.168.56.9.38668: 32940 1/4/4 (229)
13:05:54.280282 IP 192.168.56.9 > arn06s02-in-f24.1e100.net: ICMP echo request, id 2949, seq 6, length 64
13:05:54.296123 IP arn06s02-in-f24.1e100.net > 192.168.56.9: ICMP echo reply, id 2949, seq 6, length 64
13:05:54.297559 IP 192.168.56.9.48908 > vm0004.panoulu.local.domain: 15637+ PTR? 56.32.194.173.in-addr.arpa. (44)
13:05:54.299114 IP vm0004.panoulu.local.domain > 192.168.56.9.48908: 15637 1/4/4 (229)
13:05:54.923520 IP 192.168.56.1.49996 > pfSense.localdomain.ssh: Flags [.], ack 340, win 8187, options [nop,nop,TS val 755085946 ecr 706154917], length 0
13:05:54.925456 IP pfSense.localdomain.ssh > 192.168.56.1.49996: Flags [P.], ack 145, win 520, options [nop,nop,TS val 706154917 ecr 755055973], length 68
13:05:54.926328 IP 192.168.56.1.49996 > pfSense.localdomain.ssh: Flags [P.], ack 340, win 8192, options [nop,nop,TS val 755085946 ecr 706154917], length 36
13:05:54.927020 IP pfSense.localdomain.ssh > 192.168.56.1.49996: Flags [.], ack 181, win 520, options [nop,nop,TS val 706154917 ecr 755085946], length 0
13:05:55.286686 IP 192.168.56.9 > arn06s02-in-f24.1e100.net: ICMP echo request, id 2949, seq 7, length 64
13:05:55.299607 IP arn06s02-in-f24.1e100.net > 192.168.56.9: ICMP echo reply, id 2949, seq 7, length 64
13:05:55.302538 IP 192.168.56.9.46508 > vm0004.panoulu.local.domain: 18683+ PTR? 56.32.194.173.in-addr.arpa. (44)
13:05:55.306117 IP vm0004.panoulu.local.domain > 192.168.56.9.46508: 18683 1/4/4 (229)
13:05:56.288422 IP 192.168.56.9 > arn06s02-in-f24.1e100.net: ICMP echo request, id 2949, seq 8, length 64
13:05:56.305065 IP arn06s02-in-f24.1e100.net > 192.168.56.9: ICMP echo reply, id 2949, seq 8, length 64
13:05:56.306571 IP 192.168.56.9.53084 > vm0004.panoulu.local.domain: 20351+ PTR? 56.32.194.173.in-addr.arpa. (44)
13:05:56.308954 IP vm0004.panoulu.local.domain > 192.168.56.9.53084: 20351 1/4/4 (229)
13:05:57.289516 IP 192.168.56.9 > arn06s02-in-f24.1e100.net: ICMP echo request, id 2949, seq 9, length 64
13:05:57.305849 IP arn06s02-in-f24.1e100.net > 192.168.56.9: ICMP echo reply, id 2949, seq 9, length 64
13:05:57.310016 IP 192.168.56.9.47304 > vm0004.panoulu.local.domain: 17336+ PTR? 56.32.194.173.in-addr.arpa. (44)
13:05:57.314386 IP vm0004.panoulu.local.domain > 192.168.56.9.47304: 17336 1/4/4 (229)
13:05:57.565579 IP 192.168.56.9.ntp > ntp.maimed.org.ntp: NTPv4, Client, length 48
13:05:57.737926 IP ntp.maimed.org.ntp > 192.168.56.9.ntp: NTPv4, Server, length 48
13:05:58.294175 IP 192.168.56.9 > arn06s02-in-f24.1e100.net: ICMP echo request, id 2949, seq 10, length 64
13:05:58.308031 IP arn06s02-in-f24.1e100.net > 192.168.56.9: ICMP echo reply, id 2949, seq 10, length 64
13:05:58.309215 IP 192.168.56.9.41792 > vm0004.panoulu.local.domain: 37422+ PTR? 56.32.194.173.in-addr.arpa. (44)
13:05:58.314833 IP vm0004.panoulu.local.domain > 192.168.56.9.41792: 37422 1/4/4 (229)
13:05:58.565317 IP 192.168.56.9.ntp > ntp1.tdc.fi.ntp: NTPv4, Client, length 48
13:05:58.578383 IP ntp1.tdc.fi.ntp > 192.168.56.9.ntp: NTPv4, Server, length 48
13:05:59.297638 IP 192.168.56.9 > arn06s02-in-f24.1e100.net: ICMP echo request, id 2949, seq 11, length 64
13:05:59.310681 IP arn06s02-in-f24.1e100.net > 192.168.56.9: ICMP echo reply, id 2949, seq 11, length 64
13:05:59.312306 IP 192.168.56.9.40356 > vm0004.panoulu.local.domain: 17053+ PTR? 56.32.194.173.in-addr.arpa. (44)
13:05:59.315397 IP vm0004.panoulu.local.domain > 192.168.56.9.40356: 17053 1/4/4 (229)
13:05:59.567507 IP 192.168.56.9.ntp > ntp.maimed.org.ntp: NTPv4, Client, length 48
13:05:59.782141 IP ntp.maimed.org.ntp > 192.168.56.9.ntp: NTPv4, Server, length 48
13:06:01.565760 IP 192.168.56.9.ntp > ntp.maimed.org.ntp: NTPv4, Client, length 48
13:06:01.736361 IP ntp.maimed.org.ntp > 192.168.56.9.ntp: NTPv4, Server, length 48
13:06:03.571088 IP 192.168.56.9.ntp > ntp.maimed.org.ntp: NTPv4, Client, length 48
13:06:03.745432 IP ntp.maimed.org.ntp > 192.168.56.9.ntp: NTPv4, Server, length 48

